ISBN;Titre;Auteur;Annee;Editeur;Stock;Description
978-2-07-036024-8;Le Petit Prince;Antoine de Saint-Exupéry;1943;Gallimard;5;Un conte philosophique et poetique sous forme de conte pour enfants
978-2-07-040850-4;Les Miserables;Victor Hugo;1862;Gallimard;3;Roman historique de Victor Hugo
978-2-07-041239-6;Notre-Dame de Paris;Victor Hugo;1831;Gallimard;2;Roman historique se deroulant au XVe siecle
978-2-07-036822-0;Germinal;Emile Zola;1885;Gallimard;4;Roman sur la condition ouvriere dans les mines
978-2-07-041033-0;Madame Bovary;Gustave Flaubert;1857;Gallimard;3;Roman realiste de Gustave Flaubert
